question,answer,detail
地図上に実在するラーメン店が表示されません,お手数をおかけしますが、店舗リクエストをお願いいたします。,<h1>店舗リクエスト手順</h1><ol><li><a href=\"http://localhost:3000/shop_register_requests/new\">店舗リクエストページ</a>に訪れてください</li><li>店名と住所を入力してリクエストを送信してください</li><li>24時間以内にリクエスト結果を、登録メールアドレスまで連絡させていただきます。</li></ol>
どの店舗で利用できますか？,登録されている店舗をご確認ください。,<h1>登録店舗の確認方法</h1><ol><li><a href=\"http://localhost:3000/ramen_shops\">店舗検索ページ</a>に訪れてください。</li><li>名前や住所などを入力して検索してください。</li><li>店舗がある場合は利用できます。現地で「現在地から接続」を押して利用してください。</li></ol>
アプリはどこでインストールできますか？,インストール不要で、ブラウザでご利用いただけます。,<div>Safariなどのブラウザ上でご利用いただける、Webアプリとなっています。</div>
「現在地から接続」しても読み込み中が続きます。,お手持ちのスマートフォンの位置情報に関する設定をご確認ください。,<h1>位置情報に関する設定確認手順</h1><div>iPhoneのSafariをお使いの場合、以下２つの確認が必要です。</div><ol><li>iPhone本体の設定<ol><li>「<strong>設定</strong>」アプリを開いてください</li><li>「<strong>プライバシーとセキュリティ</strong>」を開いてください</li><li>「位置情報サービス」を開いてください</li><li>「位置情報サービス」が有効であることを確認してください</li><li>下にある「SafariのWebサービス」を開いてください</li><li>「次回または共有時に確認」もしくは「このアプリの使用中」が選択されていることを確認してください</li></ol></li><li>Safariの設定<ol><li>「設定」アプリを開いてください</li><li>下の方にある「Safari」を開いてください</li><li>下の方にある「位置情報」を開いてください</li><li>「確認」か「許可」であることを確認してください</li></ol></li></ol>
行列数は正確である必要がありますか？,正確な数値を希望します。ただし、把握が困難な場合はコメントをご利用ください。,<div>「待ち行列数」は自分の前に並んでいる人数を入力することを原則としています。人数把握が困難な場合は、次のように「ひとこと」欄を活用して行列の様子をシェアすることも可能です。<br><br>【ひとこと入力例】</div><ul><li>約20人</li><li>〇〇建物付近まで</li><li>折り返し3列目</li><li>店内給水機付近...など</li></ul>
